{
  "schemaVersion": "0.3.0",
  "policyId": "data-policy:synthetic_product",
  "state": "inactive",
  "owner": "human:synthetic_owner",
  "classes": [
    {
      "dataClass": "public",
      "allowedExecutionLocations": [
        "local"
      ],
      "cloudFallback": "separate_authority"
    },
    {
      "dataClass": "internal",
      "allowedExecutionLocations": [
        "local"
      ],
      "cloudFallback": "forbid"
    },
    {
      "dataClass": "private_local",
      "allowedExecutionLocations": [
        "isolated_local"
      ],
      "cloudFallback": "forbid"
    },
    {
      "dataClass": "restricted",
      "allowedExecutionLocations": [],
      "cloudFallback": "forbid"
    }
  ]
}
